review,sentiment_label,sentiment_score,keywords,themes
"Found it easy to check payments for utility services, see payment history. Login is simple and software is easy to use.",positive,0.5357355555555556,"['payment', 'payment history', 'payment utility', 'service payment', 'utility service']","['Transactions', 'Account Access']"
Please try to work on this app. It is not user-friendly and high-end. And say this while comparing with others both within and out of the country. Please try to include more features and functionality,positive,0.53444,"['try', 'compare country', 'feature functionality', 'try include', 'try work']",['Feature Requests']
Most of the time response time using msg is to slow many of wrongly transfer more than ones. I wish it is instant.,positive,0.2878066666666666,"['msg', 'time response', 'transfer wish', 'response time', 'time']","['Transactions', 'App Performance', 'Feature Requests', 'Customer Service']"
Very bad app from the so called largest bank in Ethiopia. It keeps crashing after the new update and the interface is ugly.,negative,-0.6740848484848485,"['update interface', 'crash update', 'interface', 'app bank', 'crash']",['Interface Issues']
"The app only work on working hour from 8 am-5pm it dont work at night or early in the morning, why do we need it then...try to fix it.",neutral,0.02,"['work working', 'working hour', 'morning', 'night', 'working']",['Feature Requests']
"What is this ""none available"" nonsense? The Mobile banking doesn't work either. I even went to a nearby bank to get it fixed but they don't even know what to do. This is so frustrating.",negative,-0.3878866666666666,"['nonsense', 'banking work', 'bank fix', 'work bank', 'know']","['Transactions', 'App Performance']"
"This is realy an amazing payment apps i have ever seen. It is easy, beautiful user interface and light.",positive,0.7629333333333332,"['light', 'payment app', 'user interface', 'app user', 'interface']","['Transactions', 'Interface Issues']"
Very challenging to operate taking long time and sending error message. Unfriendly every time!,negative,-0.21682,"['send error', 'time', 'time send', 'operate', 'error message']",['App Performance']
"Was so nice, days ago. But since last week I couldn't transfer and use it, properly. Would you forwarded me any option, please ? Thank you!",positive,0.5717,"['option thank', 'transfer use', 'week', 'day', 'option']",['Transactions']
"This app is smart app for me. For making it more the best, I suggest that it is good if the transactions list were up to 2 or 3 months or even more.",positive,0.7595228571428572,"['suggest', 'transaction list', 'app make', 'list', 'month']",['Feature Requests']
Better than the old one but the utility section doesn't seem to respond to any entry. Hope it gets fixed,positive,0.5135133333333333,"['respond entry', 'section respond', 'utility section', 'entry', 'hope fix']",['Transactions']
"Needs urgent fix, account balance os not showing and says none available when trying to send money.Your customer service line is also non functional, they pick up the phone and say nothing.It is unacceptable from such a huge bank.We deserve better after you tax us for sending our own money through your platform.",positive,0.42728,"['send', 'phone deserve', 'balance say', 'fix account', 'pick']",['Transactions']
This app is good but could not merge multiple CBE accounts and fails to download transaction reports after the late update. Why? I am using Samsung M12.,negative,-0.25708,"['report update', 'merge', 'transaction report', 'download transaction', 'cbe account']","['Transactions', 'Feature Requests', 'Screenshot/Restrictions', 'Notifications']"
It is a good app but sometimes very poor and i hate your rules about transfering birr only 5 times a week... We have more than 5 problem per week and it is shamefull.,negative,-0.56628,"['week', 'rule transfer', 'app hate', 'birr time', 'problem week']",['Transactions']
"After the update the app is not functioning , we expected to make physical involvement to decrease but not,work on that to make the system reliable.",neutral,-0.02,"['app function', 'expect', 'function', 'update app', 'update']",['Other']
I have been using this App simply for transfer b/c CBE accounts - Ok. But the feature to transfer to non-CBE account simply took my money to unknown account?,neutral,-0.0133333333333333,"['account', 'account money', 'transfer feature', 'transfer', 'feature transfer']","['Transactions', 'Feature Requests']"
"Like always it is the worst app of all time, even I doubt it's oudated or updated. My phone is not rooted and it says you can't use this app because it's rooted",negative,-0.77494,"['oudate', 'oudate update', 'say use', 'doubt', 'app root']",['Other']
This version is not working well the old version works with out any problem. Please make adjustment in thjs version.,negative,-0.1394599999999999,"['version', 'version work', 'work problem', 'work version', 'work']","['App Performance', 'Activation/Registration']"
It's good and easy but it has no security features like finger print or pin code for payment and log in. Not safe app,positive,0.1926577777777777,"['payment log', 'log app', 'code payment', 'pin code', 'finger print']","['Transactions', 'Account Access', 'Screenshot/Restrictions', 'Transaction History', 'Security Concerns']"
This app is good but the only difficulty with the app is it needs high speed network which makes it challenging to access it in some places,positive,0.0973599999999999,"['need speed', 'network make', 'speed network', 'challenge', 'difficulty']",['App Performance']
I was able to use the older version with ease. But now it doesn't even open and tells me that it can't be opened on rooted devices. Please fix that.,positive,0.4320288888888888,"['open', 'root device', 'device fix', 'use version', 'ease']",['Other']
It would be really awesome if it had an export to csv file option on recent transactions.,positive,0.5954,"['export', 'file', 'option transaction', 'option', 'transaction']","['Feature Requests', 'Transaction History']"
"First of all you need to be given a pin from a commercial bank, next you must have your bank book with you in order to be given the pin code. So I never got to use it, I just didn't want it that bad.",negative,-0.3899999999999999,"['pin', 'order pin', 'bank book', 'code use', 'need pin']","['Account Access', 'Feature Requests']"
The application used to work just fine a few month's before however recently it is not wornking properly and dosen't show any recent transaction.,positive,0.1387133333333333,"['wornke', 'wornke transaction', 'work month', 'application work', 'month']",['Other']
I really appreciate CBE app's move toward excellence. The receipt option included in CBE app's is very nice.,positive,0.72418,"['receipt option', 'option include', 'excellence', 'appreciate', 'receipt']","['Feature Requests', 'Screenshot/Restrictions', 'Transaction History']"
"I am unable to use mobile banking for around a month. It says ""None available"" when I try to transfer or buy airtime.",neutral,-0.0199999999999999,"['buy airtime', 'say try', 'airtime', 'buy', 'try transfer']",['Transactions']
It doesn't work and sync when you want to use and transfer money to others. Why CBE is not working to solve the problem.,negative,-0.2744399999999999,"['work solve', 'money work', 'use transfer', 'work sync', 'want use']","['Transactions', 'App Performance', 'Feature Requests', 'Activation/Registration']"
"The new update is horrible. Unreliable. I can't send money nor check my balance. Set your priorities straight, CBE",negative,-0.3175648484848484,"['priority', 'money check', 'set', 'check balance', 'send money']",['Transactions']
"The best mobile banking in the world. I love it, thank you!!!! But try to have more servers, sometimes it is busy.",positive,0.73844,"['world love', 'banking world', 'love thank', 'server', 'world']",['Transactions']
This up is very good only problem is no access of seeing your balance Otherwise it is very easy to you use and its so fast just work on that above mentioned Stay blessed 🙏🙏🙏❤️,positive,0.5711466666666667,"['bless', 'problem access', 'balance use', 'mention', 'stay']","['Transactions', 'International Use']"
Most of the things work just fine. But the transaction history doesn't work properly/right.,positive,0.2449533333333333,"['work right', 'right', 'thing work', 'work transaction', 'work']","['Transactions', 'App Performance', 'Feature Requests', 'Transaction History']"
"what a nice!. user friendly, easy to access, updated, Amharic supported, error solved and well developed app.",positive,0.7057733333333334,"['user access', 'amharic', 'develop app', 'develop', 'support']","['App Performance', 'Language Support']"
Please don't make us force update the app it log us out and we need to go in person to the branch to use the app that is hard for people like us who travele a lot from country,positive,0.1993533333333332,"['people travele', 'person branch', 'app log', 'force update', 'log need']","['Feature Requests', 'Transaction History', 'Customer Service']"
"Starting from the past two weeks, it is not working properly. Did you release any update? If not please investigate the problem and solve it.",negative,-0.2933133333333333,"['work release', 'problem solve', 'release update', 'release', 'start']","['App Performance', 'Activation/Registration']"
The app only shows 25 transaction. The most frustrating it ever. Other banks gives you months of transactions ans statement. What a joke,negative,-0.15154,"['bank month', 'joke', 'month transaction', 'transaction statement', 'transaction bank']",['Customer Service']
The app was like very wonderful and easy to use but currently some problem is faced me which is after login does not show me account balance and account number.how can i solve this problem??,neutral,-0.0341888888888888,"['problem', 'account', 'login account', 'balance account', 'problem face']","['Transactions', 'Account Access']"
What an awful app... Doesn't tell you it charges you for transferring money to another bank.. useless... Hard to use and glitches. Barely works,negative,-0.6586066666666667,"['glitch work', 'charge transfer', 'app tell', 'bank use', 'glitch']",['Interface Issues']
"was working fine, but now it crashes after the update and lots of people are complaining about it but you chose to keep silent",neutral,-0.0380466666666666,"['people complain', 'lot people', 'complain', 'work crash', 'choose']",['Notifications']
"- It is best application , but you have to integret the tele- birr service to any mobile service number by titening the security tunnels rather than own mobile service number only",positive,0.6723333333333333,"['service number', 'service', 'number', 'security tunnel', 'service service']","['Transactions', 'Account Access', 'Security Concerns']"
"It is good service, but the service charge is not fair. I prefer to get the service in physical or ATM unless otherwise diffulty case happened.",neutral,-0.0291133333333333,"['service', 'case happen', 'service service', 'service charge', 'case']",['Transactions']
This app fast and fact every solution thanks,positive,0.46214,"['fact', 'solution', 'thank', 'app']",['Other']
"It need some listed improvements below. 1. Try to desplay at lst one month transaction 2. Try to solve weekend transaction display error 3. ""Failed"" message after few processing",negative,-0.4042399999999999,"['try', 'fail message', 'processing', 'transaction try', 'display error']","['Transactions', 'App Performance', 'Feature Requests', 'Notifications']"
Easy and fast but some time it show us error but the trasaction is alrady sent and the error mislead us and we do the trx again. This affect our acount twice,negative,-0.3119933333333333,"['error', 'send error', 'acount', 'time error', 'trasaction']",['App Performance']
"Pretty straightforward, does what it's supposed to do. Wish it had beefier/ more detailed recent transactions though.",positive,0.54776,"['suppose', 'wish', 'transaction']",['Feature Requests']
"Some transaction is not going to be processed accordingly. Which going to take 3-5days which is not completely right. since this bank has mass of customers. However, It should be considered as the money can be needed for emergency purposes.",negative,-0.2862228571428571,"['process bank', 'mass', 'mass customer', 'money need', 'need emergency']",['Transactions']
"it's not best like abyssinya mobile bank. This not show the transaction and didn't get notification , SMS text.",negative,-0.60086,"['sms text', 'sms', 'notification', 'text', 'transaction']","['Transactions', 'Interface Issues', 'Notifications']"
"The app is very nice to use but why you guys are cutting 10birr for each transaction to telebirr? Please, consider all market segments, there are students and labour workers. We all are not that rich 10birr+ service fee to be cut. CBE please, consider these thing.",neutral,0.02162,"['cut', 'consider', 'segment', 'segment student', 'worker service']",['Transactions']
"Great app, but the only problem, i encounter with it is that branches are not willing to open it for you, every branch will try to send you else where",negative,-0.0824999999999999,"['branch', 'branch try', 'branch open', 'problem encounter', 'try send']",['Customer Service']
The Updated version of the app is awesome. Really Enjoyable to got sealed Receipts with barcode.🙏🙏,positive,0.7842,"['seal', 'seal receipt', 'version app', 'update version', 'receipt']",['Other']
"Continuous updates of the app makes it easy, fast, and secure to use. I feel safe and secured to use this app. Thanks CBE🙏",positive,0.6878466666666667,"['feel use', 'make use', 'feel', 'use', 'app make']",['Other']
Wow! This last update solved the problem of some system compatibility issues. now it works fine. thanks?,positive,0.5551266666666667,"['problem compatibility', 'compatibility', 'compatibility issue', 'issue work', 'work thank']",['Other']
"Since Yesterday New Update, It doesn't show my amount and doesn't task anything at all ! I hope to fix this issues sooner than later!",positive,0.358030909090909,"['yesterday update', 'yesterday', 'hope fix', 'fix issue', 'task']",['Transactions']
This app makes me upset. When they update the app they are updating bug not the functionality of the system.,negative,-0.2290799999999999,"['update bug', 'update', 'functionality', 'app make', 'app update']","['App Performance', 'Feature Requests']"
"It is good app ,except that it only shows recent transactions.It need further improvements to include such features & other genuine prevention on security breach.",positive,0.5147142857142857,"['security breach', 'include feature', 'app need', 'need improvement', 'include']","['Account Access', 'Feature Requests', 'Security Concerns']"
"When you try to search for a help (chat, hotline, email, phone) you see the bottom ""Help"" which redirectes you to !!!Donations to various charity organisations. Please dear CBE IT department , when user searches for help it is to get assistance not to give money. What you named help other banks call ""Charity"" ""Donate"" etc. And yes users need HELP. Not everyone has opportunity to run 5 times per day to the branch and try to find why the money he transferred is disappeared.",positive,0.5583199999999999,"['help', 'charity', 'search help', 'search', 'try']","['Feature Requests', 'Customer Service']"
It shut down without warning,positive,0.0928177777777777,"['warn', 'shut']",['Other']
Nice app but the transaction history is not accurate and it doesn't sync at times.,positive,0.2157799999999999,"['sync time', 'app transaction', 'transaction history', 'sync', 'history']","['Transactions', 'App Performance', 'Feature Requests', 'Transaction History']"
"Relatively good app, but we need electronic receipt or advice in PDF format to be printed for every transaction or payment we made (AWSA, EEU,IMMIGRATION FOR PASSPORT, ...) think about it.",positive,0.4229199999999999,"['passport think', 'payment awsa', 'pdf format', 'receipt advice', 'need receipt']","['Transactions', 'Feature Requests', 'Screenshot/Restrictions', 'Transaction History']"
Good update 👍👍 Scanning Qr code for receipt and receive money via qr code is good. But please make the CBEBirr app work easly like this it's not working on android version under 8.,positive,0.7865199999999999,"['code', 'receipt receive', 'scan code', 'money code', 'scan']","['Transactions', 'App Performance', 'Feature Requests', 'Screenshot/Restrictions', 'Transaction History', 'Activation/Registration']"
Its very good application specialy with 4G Network Conection. However The Service Payment is Expensive. Do It Please Justified With Our Economy Label,positive,0.5889599999999999,"['payment justify', 'application network', 'service payment', 'economy', 'network']","['Transactions', 'App Performance']"
It's easy and convenient 🙌,positive,0.4375733333333333,[],['Other']
"The Commercial Bank of Ethiopia (CBE) is a pillar of financial strength and stability in Ethiopia. As the largest and most established bank in the country, it fosters economic growth, promotes financial inclusion, and supports businesses of all sizes. CBE’s mobile banking app enhances convenience by enabling millions to access banking services anytime, anywhere. Keep up Good work❤.",positive,0.6633933333333333,"['promote', 'promote inclusion', 'access banking', 'growth', 'stability']",['Transactions']
One of the most useless app in the country. Doesn't work almost 99 percent of the time.,negative,-0.28524,"['percent', 'percent time', 'app country', 'country', 'time']",['App Performance']
Excellent app... never had any problem in using it. Very excellent job you are doing CBE. Get going!!!!,positive,0.94156,"['problem job', 'app problem', 'job', 'problem', 'app']",['Other']
it does not connect,neutral,0.0,['connect'],['Other']
Hooo I love this application,positive,0.58214,"['love application', 'love', 'application']",['Other']
it's very good 👍 app,positive,0.65962,['app'],['Other']
thank you for help,positive,0.38214,"['thank help', 'help', 'thank']",['Other']
Fast and Reliable,positive,0.08,[],['Other']
"Freindly app, suitable for many clients.sometimes, synchronization would not be possibe.",positive,0.21,['synchronization'],['App Performance']
The app has good flexibility for day to day activities and stuff but it takes unessential amount of money for no valid reason which is very disappointing,negative,-0.44116,"['day', 'money reason', 'stuff', 'day activity', 'day day']",['Transactions']
it's very nice 👍.,positive,0.59724,[],['Other']
It is not functioning most of the time,positive,0.2,"['function', 'time']",['Other']
Since the last two weeks I could not see balance. It becomes busy and difficult to check remaining amount.,negative,-0.2700533333333333,"['balance check', 'week balance', 'week', 'check', 'balance']",['Other']
its not fast,neutral,-0.04,[],['Other']
"If you are living outside of Ethiopia you better not deposit large money into your mobile account. It can kick you off any time for some small reasons and the only way you can recover is either to go to the bank in person or you need to have access to your phone which is impossible if you are living outside Ethiopia. The only option you will be left with is, you can't use your money. At least it would be better if you can recover your account using email or other verification ...",positive,0.4159339682539683,"['live ethiopia', 'recover', 'live', 'ethiopia', 'option leave']","['Transactions', 'Account Access', 'Feature Requests', 'Customer Service']"
This app is best if you add fingerprint or facial authentication instead of the current one.,positive,0.5154733333333333,"['fingerprint authentication', 'add fingerprint', 'fingerprint', 'app add', 'authentication']","['Account Access', 'Feature Requests']"
When I open the app it turns off keep says (app has a bug ) the app needs update,neutral,0.0,"['bug app', 'say app', 'app turn', 'app bug', 'need update']",['App Performance']
Crashing frequently every time I try to log in.. it's so annoying,negative,-0.4646,"['try log', 'time try', 'crash time', 'log', 'crash']",['Transaction History']
useful update but at the moment its not easy to download or update and that means we can't use the the app at the moment,negative,-0.1553533333333333,"['moment', 'update', 'mean', 'use app', 'download']","['Feature Requests', 'Screenshot/Restrictions']"
Great app convenient for making payments and transactions. Tnxs CBE 👏👏👏,positive,0.6949400000000001,"['payment transaction', 'make payment', 'app make', 'payment', 'make']",['Other']
Even if i had a balance of >0 i couldn't Even transfer any of my balance starting from 0-10257.,neutral,0.0,"['balance', 'balance transfer', 'start', 'transfer']",['Transactions']
Please make it active it is delaying in low connection thanks.,positive,0.4290688888888889,"['connection thank', 'delay', 'connection', 'thank']",['App Performance']
It's simple and easy to use,positive,0.3509066666666666,['use'],['Other']
#CBE is Now going to on the right Pathway/track/!! Thank you CBE one step ahead on payment platform app!!,positive,0.6193978571428571,"['pathway', 'pathway thank', 'payment platform', 'thank cbe', 'platform']",['Transactions']
If you want change your phone device or if your app suddenly deleted you must go to Bank branch and pay CBE mobile banking activation payment again and again. this is not appropriate. additionally customer service at branch is disgusting,negative,-0.4920466666666667,"['branch', 'pay mobile', 'payment customer', 'phone device', 'service branch']","['Transactions', 'Feature Requests', 'Customer Service']"
Can we see our past transaction record more than recent on this app ??? Please it should have this option .If so tell me how if not please update thIs app soon to accommodate this to obtain as this bank deserves more and more capacity and update every day even every minutes as it represents the golden brand ETHIOPIAN!!!,positive,0.3698958333333333,"['record app', 'obtain bank', 'option tell', 'represent', 'tell update']","['Transactions', 'Feature Requests', 'Screenshot/Restrictions', 'Transaction History']"
It shows a limited number of transaction history. And it does show transactions history in the order of arrival,negative,-0.1204314285714285,"['transaction history', 'history', 'order arrival', 'history order', 'number transaction']","['Transactions', 'Feature Requests', 'Transaction History']"
"The recent update has a bug. ""Transfer to other bank option"" will force close the app. Please fix it.",positive,0.1659199999999999,"['option force', 'bank option', 'bug transfer', 'update bug', 'close app']",['App Performance']
"The most recent update is so impressive that Stops stucking,Speedy transaction.Thanks and keep updating.",positive,0.5139199999999999,"['stucking', 'update stop', 'update', 'stop']",['Other']
The old version was bad and difficult to login. but this one is amazing and user friendly.,positive,0.48056,"['login user', 'login', 'version', 'user']",['Other']
It is not synchronizing. It was working nicely for me but now not updating my balance. Talked to the bankers but failed to solve it.,negative,-0.17092,"['talk', 'update balance', 'synchronize', 'work update', 'solve']",['Transactions']
CBE app is great,positive,0.6949400000000001,[],['Other']
Why did this application stopped working at the moment,negative,-0.1357799999999999,"['moment', 'application stop', 'stop work', 'stop', 'application']",['Other']
"Though the app is a better enough in its service till now, now we can't access the service as it tells us no network and sync , thus please update it",positive,0.3752799999999999,"['network sync', 'service access', 'service', 'service tell', 'access service']",['App Performance']
"It's good app, couse of shawing the debit & credit amount on time it's sometimes late if not I could have given it 5 star.",positive,0.4823,"['app couse', 'couse', 'debit credit', 'debit', 'credit']","['Transactions', 'Notifications']"
"Self transfer has a problem. Doesn't tell weather trasfered or not after the process,ie ignors the final issuance of reciept .....",negative,-0.2411399999999999,"['process ignor', 'problem tell', 'reciept', 'self', 'process']",['Transactions']
it's not working properly,neutral,0.0,['work'],"['App Performance', 'Activation/Registration']"
It nice but some connection limitation,positive,0.10422,"['limitation', 'connection']",['App Performance']
"It's simple, fast, easy to use and very pleasant. For me, it is a pleasant application of my bank that I always trust.",positive,0.7376,"['bank trust', 'application bank', 'trust', 'use application', 'application']",['Other']
I used to do everything with it but now it says can't sync. I can not do anything with it now. I'm having difficulties. Please try to fix it,neutral,0.0232199999999999,"['say sync', 'difficulty', 'try fix', 'sync', 'say']",['Other']
i like the app,positive,0.21672,"['like app', 'like', 'app']",['Other']
okay 👍 but sometimes busy,positive,0.18924,[],['Other']
its very nice,positive,0.59724,[],['Other']
Very nice and fast app,positive,0.48124,['app'],['Other']
I like it.,positive,0.21672,['like'],['Other']
"I am new to this app, I downloaded just right now from playstore and i it asked me for Verification code and i don't have it, Someone please help me......To solve the issue.",positive,0.5045955844155844,"['code help', 'playstore', 'help solve', 'solve issue', 'app download']","['Account Access', 'Activation/Registration']"
why you change default network?,neutral,0.0,"['default', 'change', 'network']",['Other']
"After updating the latest version, the app is no longer able to synchronize. Urgent fixation needed.",positive,0.13838,"['synchronize', 'version app', 'update version', 'version', 'need']",['Other']
