review,sentiment_label,sentiment_score,keywords,themes
Very poor app from a huge bank.,negative,-0.18696,"['app bank', 'bank', 'app']",['Other']
easy to use,positive,0.4375733333333333,['use'],['Other']
great when it works,positive,0.6949400000000001,['work'],['Other']
very nice app ever!!!,positive,0.76504,['app'],['Other']
a very nice app.👍👍👍,positive,0.59724,['app'],['Other']
"Great, please include bank statement options.",positive,0.77036,"['statement option', 'include bank', 'bank statement', 'include', 'statement']","['Feature Requests', 'Transaction History']"
you must added dark mode options ❗,negative,-0.06,"['add mode', 'mode', 'add', 'option']","['Feature Requests', 'Interface Issues']"
very interesting app,positive,0.5345599999999999,['app'],['Other']
i can't take screenshot,neutral,0.0,['screenshot'],['Screenshot/Restrictions']
It has been really helpful. Thank u CBE,positive,0.5042,['thank'],['Other']
It is very nice app. I recommend all to use it.,positive,0.7200600000000001,"['recommend use', 'app recommend', 'recommend', 'use', 'app']",['Other']
its so excellent app,positive,0.7669,['app'],['Other']
Very Amazing Apps,positive,0.6864000000000001,['app'],['Other']
It is so easy to use nice app,positive,0.6632066666666667,"['use app', 'use', 'app']",['Other']
Some time it is not working,neutral,0.0,"['time work', 'time', 'work']","['App Performance', 'Activation/Registration']"
good app and very inspiring,positive,0.70068,['app'],['Other']
it's not good app,negative,-0.3447199999999999,['app'],['Other']
It's good app,positive,0.54424,['app'],['Other']
Nice and easy app,positive,0.6211466666666666,['app'],['Other']
Does not work after update,neutral,0.0,"['work update', 'update', 'work']",['Other']
Excellent application appreciated!!!!,positive,0.80579625,"['application appreciate', 'appreciate', 'application']",['Other']
It says non available always disappointing,negative,-0.33634,['say'],['Other']
"It is the best mob.banking app, i ever used.",positive,0.7821400000000001,['app'],['Other']
It is easiest app i ever seen 🤷‍♂️🤷‍♂️,positive,0.2528999999999999,['app'],['Other']
"Nice platform, thanks.",positive,0.57448,"['platform', 'thank']",['Other']
What an update its amazing Super Fast,positive,0.647371111111111,['update'],['Other']
not responsive most of the time.,neutral,0.0347,['time'],['Other']
Why stacked sometimes,neutral,0.0,['stack'],['Other']
"That's good,but it deserves security l.",positive,0.204,"['deserve', 'security']","['Account Access', 'Security Concerns']"
Very good but latley has been some glitchs,positive,0.5274399999999999,['glitch'],['Other']
"One of the best apps I have used ,",positive,0.7821400000000001,['app'],['Other']
I cant pass the authorization key how do i find it? Please reply if u know.,positive,0.1909199999999999,"['pass authorization', 'reply know', 'pass', 'reply', 'authorization key']",['Activation/Registration']
This should run for worst app of the year,negative,-0.77494,"['run app', 'app year', 'run', 'year', 'app']",['Other']
I have been a customer of the Commercial Bank of Ethiopia for many years,positive,0.1,"['bank year', 'customer bank', 'year', 'customer', 'bank']",['Other']
easy to access,positive,0.4375733333333333,['access'],['Other']
Easy beautiful design,positive,0.7236466666666665,['design'],['Interface Issues']
Easy & attractive !,positive,0.7224466666666667,[],['Other']
Fantastic I love the simplicity,positive,0.67896,"['love simplicity', 'simplicity', 'love']",['Other']
Totally no response when calling on 951.,negative,-0.21582,['response'],['Customer Service']
It is good application and expected to move the financial sector forward,positive,0.34424,"['sector', 'expect', 'application']",['Other']
Its good app,positive,0.54424,['app'],['Other']
The best mobile app in Ethiopia,positive,0.7821400000000001,"['app ethiopia', 'ethiopia', 'app']",['Other']
Almost Impossible to use it aboard.,negative,-0.2511866666666666,['use'],['Other']
Better than the other CBE system to send money.,positive,0.33924,"['send money', 'cbe', 'send', 'money']",['Other']
"Cannot access with no reason,",positive,0.1341,"['access reason', 'reason', 'access']",['Other']
It's recommended to use this any other banking system,positive,0.07138,"['recommend use', 'use banking', 'recommend', 'banking', 'use']",['Other']
Onli add monthly statement page list.,neutral,0.0,"['page list', 'add statement', 'page', 'list', 'statement']","['Feature Requests', 'Transaction History']"
It's amazing app easy to use,positive,0.6696866666666667,"['app use', 'use', 'app']",['Other']
Does not work properly,neutral,0.0,['work'],['Other']
I love the update . Nice work,positive,0.69436,"['love update', 'update work', 'love', 'update', 'work']",['Other']
I don't see any options for outside of the country users.,neutral,0.0,"['option country', 'country', 'option', 'user']",['Other']
The most stupidly incredible bank i didn't known how a system get so stupid,negative,-0.41512,"['bank know', 'know', 'bank']",['Other']
New update new version not working,positive,0.0545454545454545,"['version work', 'update version', 'version', 'update', 'work']","['App Performance', 'Activation/Registration']"
It's to easy to transfer local money thats why.,positive,0.3509066666666666,"['transfer money', 'money', 'transfer']",['Transactions']
Not working very well,negative,-0.0743199999999999,['work'],"['App Performance', 'Activation/Registration']"
it securty is good for hackeres,positive,0.54424,"['securty', 'securty hackere']",['Other']
I wonder this up if it gives the mini statement with narrative details,neutral,0.0,"['wonder statement', 'wonder', 'statement']","['Feature Requests', 'Transaction History']"
Fast and easy,positive,0.3909066666666666,[],['Other']
No speed to reload,negative,-0.1775999999999999,['speed'],['App Performance']
Nice up easy to use,positive,0.6211466666666666,['use'],['Other']
It is busy more time why is it?,positive,0.12,['time'],['Other']
difficult on using occasional time.,negative,-0.31672,['time'],['Other']
No way to give negative feedback. toughen up!,negative,-0.58578,"['feedback', 'way']",['Other']
Great app for an Ethiopian perspective,positive,0.6949400000000001,"['perspective', 'app']",['Other']
I uninstalled the app but Now I can't download it,neutral,0.0,"['uninstalle app', 'uninstalle', 'app download', 'download', 'app']","['Feature Requests', 'Screenshot/Restrictions']"
Better and easy to use it,positive,0.6068466666666666,['use'],['Other']
Verification key sucks after installing again,negative,-0.2767199999999999,"['suck', 'verification key', 'instal', 'key', 'verification']","['Account Access', 'Activation/Registration']"
"It is very good, it make my life easy !!",positive,0.7795366666666667,['life'],['Other']
It is best app but samtime busy,positive,0.44908,['app'],['Other']
Best of the best application for ever,positive,0.9133,['application'],['Other']
Working very good yet than the other methods I know before,positive,0.45262,"['method', 'know', 'work']",['Other']
Difficult to update,negative,-0.41672,['update'],['Other']
it's special apps,positive,0.3839971428571428,['app'],['Other']
I have very happiness by this service thank you cbe,positive,0.81406,"['service thank', 'thank', 'service']",['Other']
Very nice and attractive application,positive,0.75982,['application'],['Other']
Very nice app thanks for the create,positive,0.68224,"['create', 'app thank', 'thank', 'app']",['Other']
I'm using this supplication when I'm out of my country this is useful,positive,0.3842399999999999,['country'],['Other']
Cbe is the leader bank in Ethiopia by digital payment system,neutral,0.0,"['leader', 'payment', 'bank']",['Transactions']
It is very nice and professional 👌,positive,0.68546,[],['Other']
simplest app. that i have ever used..,neutral,0.0,['app'],['Other']
Very good app & constant ever,positive,0.47762,['app'],['Other']
Best and user friendly app,positive,0.76256,"['user app', 'user', 'app']",['Interface Issues']
The new version of the app is awesome!,positive,0.6225527272727273,"['version app', 'version', 'app']",['Other']
Intersting and real app,positive,0.08,"['intersting', 'intersting app', 'app']",['Other']
Not work some tumes,neutral,0.0,"['work tume', 'work']",['Other']
The application is not user freindly at all,neutral,0.0,"['application user', 'user', 'application']",['Other']
More or less it is Good Application.Go Ahead.,positive,0.3712977777777777,[],['Other']
Simple and friendly,positive,0.37134,[],['Other']
Its not functional with my device whats wrong?,negative,-0.48602,['device'],['Other']
The best mobile app.,positive,0.7821400000000001,['app'],['Other']
I love it. Keep up your good work,positive,0.71784,"['love work', 'love', 'work']",['Other']
To save my time best app to me i like this app tnx cbe !!!,positive,0.9499,"['app tnx', 'tnx', 'time app', 'app like', 'save time']","['Screenshot/Restrictions', 'Transaction History']"
Its good enough to transaction,positive,0.4042399999999999,['transaction'],['Transactions']
The last update is useless!!,negative,-0.4707699999999999,['update'],['Other']
Please Add the Biometric system on the app,positive,0.1909199999999999,"['add', 'app']","['Account Access', 'Feature Requests']"
Best and ease to use,positive,0.86302,"['ease', 'use']",['Other']
Very good and easy to use.,positive,0.7171066666666666,['use'],['Other']
So amazing app I've ever seen,positive,0.6144000000000001,['app'],['Other']
"Does""nt give you a list of beneficieries.",neutral,0.0,['list'],['Other']
couldnt update the app,neutral,0.0,"['update app', 'update', 'app']",['Other']
Apdates went to dismiss the developer option,neutral,0.0,"['apdate', 'developer option', 'developer', 'option']",['Feature Requests']
Solve unwanted time and the time to losses cbe office,negative,-0.2528999999999999,"['time time', 'time', 'office', 'solve']",['Other']
What's your problem with developer option ???,negative,-0.30042,"['problem developer', 'developer option', 'developer', 'option', 'problem']",['Feature Requests']
Great Mobile Banking Apps from great bank💞💞💞💞💞💞💞💞,positive,0.9158,"['banking app', 'banking', 'app']",['Transactions']
Very amazing application,positive,0.6864000000000001,['application'],['Other']
It is very nice app,positive,0.59724,['app'],['Other']
It's good to have this app for easy use,positive,0.6468466666666667,"['app use', 'use', 'app']",['Other']
Simple good app,positive,0.4042399999999999,['app'],['Other']
Not used fully amount,neutral,0.0,[],['Transactions']
Not that much good!,positive,0.1091,[],['Other']
the worst app i have ever seen,negative,-0.77494,['app'],['Other']
Does not work i can not update,neutral,0.0,"['work update', 'update', 'work']",['Other']
Good challenge good.,positive,0.71614,['challenge'],['Other']
Easy to use. Love it.,positive,0.6645066666666667,"['use love', 'love', 'use']",['Other']
"Please, still now, I am not accepting codes for activation of my account. help",positive,0.2547,"['activation account', 'account help', 'accept', 'activation', 'help']",['Other']
It's not working please make it something,negative,-0.14466,['work'],"['App Performance', 'Activation/Registration']"
The updated cbe application is perfect,positive,0.7431399999999999,"['cbe application', 'cbe', 'application', 'update']",['Other']
Why it stucks?i cant see my balance and accunt nuber site,neutral,0.0,['balance'],['Transactions']
fast and easy,positive,0.3909066666666666,[],['Other']
Very nice to used online,positive,0.59724,[],['Other']
I like the app,positive,0.21672,"['like app', 'like', 'app']",['Other']
Please download fastly the apps,positive,0.27092,"['download app', 'download', 'app']","['Feature Requests', 'Screenshot/Restrictions']"
the app not fast enough,neutral,-0.02,"['fast', 'app']",['Other']
Maybe the only nun crushing banking app in ET??,negative,-0.1797399999999999,"['crush', 'banking app', 'banking', 'app']",['Other']
It's progress very well Thanks,positive,0.5666599999999999,"['progress thank', 'progress', 'thank']",['Other']
The best and secured app thank you!,positive,0.9193,"['app thank', 'thank', 'app']",['Other']
I love it it is perfect I am proud of my bank,positive,0.8467266666666666,"['love bank', 'love', 'bank']",['Other']
Love this app Couse it makes my life Easier,positive,0.67436,"['app couse', 'couse', 'make life', 'love app', 'life']",['Other']
It's easy to use and safe,positive,0.6068466666666666,['use'],['Other']
Great !!! I am happy for this app.,positive,0.879,['app'],['Other']
Easy and goood app,positive,0.4375733333333333,['app'],['Other']
Doesn't sync multiple accounts,neutral,0.0,"['sync account', 'sync', 'account']",['App Performance']
Why is it not working well it is not even showing me the money I have,negative,-0.1234199999999999,"['money', 'work']","['App Performance', 'Activation/Registration']"
wow simple life,positive,0.37154,['life'],['Other']
The weirdest bank ever. Weird customer service weird network.....,negative,-0.50636,"['bank customer', 'customer service', 'network', 'customer', 'service']",['Other']
I really luv this app it's makes life get easy,positive,0.3909066666666666,"['make life', 'app make', 'life', 'make', 'app']",['Other']
I can't update the app on my mobile,neutral,0.0,"['app mobile', 'mobile', 'update app', 'update', 'app']",['Other']
Improved performance with the new version.,positive,0.3405654545454545,"['performance version', 'performance', 'improve', 'version']",['Other']
Good application and Best for use,positive,0.81784,"['application use', 'application', 'use']",['Other']
Great mobile banking app,positive,0.6949400000000001,"['banking app', 'banking', 'app']",['Transactions']
Good and simpl for use,positive,0.54424,"['simpl', 'simpl use', 'use']",['Other']
What a helpful and latest app!,positive,0.53518,['app'],['Other']
It works only on WiFi,neutral,0.0,"['work wifi', 'wifi', 'work']",['Other']
Easy and safe app,positive,0.6068466666666666,['app'],['Other']
simply for used,neutral,0.0,[],['Other']
It has speed than the others,neutral,0.0,['speed'],['Other']
This is not working without Ethiopia Not downloaded,neutral,0.0,"['download', 'work']","['App Performance', 'Activation/Registration']"
Good but you must improve it,positive,0.70018,['improve'],['Other']
I cannot access the services to transferor to pay my bills,negative,-0.0616199999999999,"['access service', 'pay', 'access', 'service']",['Other']
Most of the time it doesn't work,positive,0.2,"['time work', 'time', 'work']",['App Performance']
It is Very easy to use.,positive,0.5209533333333334,['use'],['Other']
This is a good appp,positive,0.54424,[],['Other']
it is not good it's like eka eka chewata,negative,-0.4668799999999999,[],['Other']
It is really the best one I love it Thank you,positive,0.7689466666666667,"['love thank', 'love', 'thank']",['Other']
Its Good works great,positive,0.7743599999999999,['work'],['Other']
Excellent app but not CBE,positive,0.59746,"['app cbe', 'cbe', 'app']",['Other']
It asks authorization key I'm cofused with it which is the authorization key,neutral,0.0,"['authorization key', 'key', 'authorization', 'ask authorization', 'ask']",['Activation/Registration']
it's the best app i,positive,0.7821400000000001,['app'],['Other']
Nice app and always use.,positive,0.4928999999999999,"['app use', 'use', 'app']",['Other']
It donsnt show the new amount after there is a deposit,positive,0.0545454545454545,['deposit'],['Transactions']
Very efficient app,positive,0.36524,['app'],['Other']
"Very good app, but why we don't see the statements?",positive,0.5274399999999999,"['app statement', 'statement', 'app']",['Other']
Best app that constitutes all in one.,positive,0.7821400000000001,['app'],['Other']
Good to have this app on my phone.,positive,0.54424,"['app phone', 'phone', 'app']",['Other']
Easy to use,positive,0.4375733333333333,['use'],['Other']
It's not appropriate for Play store,negative,-0.25504,"['play store', 'store', 'play']",['Other']
Good very good,positive,0.7578400000000001,[],['Other']
Not working at all!,neutral,0.0,['work'],"['App Performance', 'Activation/Registration']"
It don't work,neutral,0.0,['work'],['Other']
That is good bank but there is something wrong 😕,negative,-0.39866,['bank'],['Other']
I like this app it is better than the previous one!,positive,0.4723333333333333,"['like app', 'like', 'app']",['Other']
Why not access in galaxy s7 edge??,neutral,0.0,"['galaxy edge', 'galaxy', 'edge', 'access']",['Other']
Amazing for saving time,positive,0.59154,"['save time', 'save', 'time']",['Other']
Good mobile banking app,positive,0.54424,"['banking app', 'banking', 'app']",['Transactions']
It is very good to send recieve m9ney transfer,positive,0.65962,"['recieve transfer', 'send recieve', 'recieve', 'send', 'transfer']",['Transactions']
"Wow, its easy to use",positive,0.5696866666666667,"['easy use', 'easy', 'use']",['Other']
"Nice but sometimes, all little....",positive,0.2182799999999999,[],['Other']
"Great app, it like bank on my hand",positive,0.8413400000000001,"['bank hand', 'hand', 'app bank', 'bank', 'app']",['Other']
I like and satisfy by using commercial bank of Ethiopia thanks,positive,0.52756,"['satisfy bank', 'bank thank', 'satisfy', 'like', 'thank']",['Other']
It isMore comfortable application!,positive,0.53372,['application'],['Other']
Makes everything easy,positive,0.4375733333333333,['make'],['Other']
Why there is no ussd service for mobile banking.,negative,-0.1775999999999999,"['service banking', 'service', 'banking']",['Other']
It is bad and the app made my phone to behave bad,negative,-0.7543599999999999,"['phone behave', 'app phone', 'phone', 'app']",['Other']
"best, simple, efficient ...... 👏👏👏👏👏👏",positive,0.67436,[],['Other']
It's wonderful app Tanks befor.,positive,0.7431399999999999,"['app tank', 'tank', 'app']",['Other']
Best app and simple to use,positive,0.58214,"['app use', 'use', 'app']",['Other']
It says none avaliable and stopped,positive,0.1017,"['say stop', 'stop', 'say']",['Other']
App is don't show balance,neutral,0.0,['balance'],['Transactions']
its fast & good app so 10q,positive,0.6255,['app'],['Other']
Excellence and facilitant spp,positive,0.37494,[],['Other']
Horrible can't sync my account,negative,-0.72538,"['sync account', 'sync', 'account']",['App Performance']
The worst app I have ever seen I hate it.,negative,-0.85896,"['app hate', 'hate', 'app']",['Other']
Sometimes it's too annoying 🙄.,negative,-0.56114,[],['Other']
Good app for making payments.,positive,0.54424,"['make payment', 'app make', 'payment', 'make', 'app']",['Other']
Best banck in Ethiopia,positive,0.7821400000000001,"['banck', 'ethiopia']",['Other']
Good application and helpful,positive,0.69448,['application'],['Other']
This app is very active and past,positive,0.1898933333333333,['app'],['Other']
It asking verification code where could i find it. Please help,positive,0.36744,"['code help', 'ask verification', 'verification code', 'verification', 'ask']","['Account Access', 'Activation/Registration']"
They are giving good services❤,positive,0.7954599999999998,['service'],['Other']
crashing crashing and crashing fix it,neutral,0.0,"['crash crash', 'crash', 'crash fix', 'fix']",['Other']
Dear CBE Team Please include the international card balance details in the CBE app.,positive,0.35964,"['cbe team', 'team', 'card', 'include', 'cbe']","['Transactions', 'Feature Requests', 'International Use']"
Very easy to use!,positive,0.6056666666666667,['use'],['Other']
This app is more relable and good to use .,positive,0.53262,"['app use', 'use', 'app']",['Other']
Home page Loading for 5 min on 4G net are you kidding me😬😬,negative,-0.3160199999999999,"['kid', 'min', 'net', 'page load', 'home page']",['App Performance']
Very very bad app so embarrassing,negative,-0.8370399999999999,['app'],['Other']
Not user-friendly.,neutral,0.0,['user'],['Other']
Crashed after update,neutral,0.0,"['crash update', 'crash', 'update']",['Other']
absolutely magnificent app!!!,positive,0.8345800000000001,['app'],['Other']
Some time network problems,negative,-0.2411399999999999,"['network problem', 'time network', 'network', 'problem', 'time']",['App Performance']
The last update was useless,negative,-0.3529,['update'],['Other']
Commercial bank of Ethiopia is Our best best bank alwayes found where we go. I love my bank.,positive,0.8064399999999999,"['bank love', 'love bank', 'bank', 'love']",['Other']
Nice &simple app,positive,0.3728999999999999,['app'],['Other']
it's great,positive,0.6949400000000001,[],['Other']
Why is it asking me for developer option,neutral,0.0,"['ask developer', 'developer option', 'ask', 'developer', 'option']",['Feature Requests']
Best mobile banking app ever,positive,0.7821400000000001,"['banking app', 'banking', 'app']",['Transactions']
"Do proud of my people in CBE , the developers Great mobile app !!!!",positive,0.8726400000000001,"['people developer', 'people', 'developer', 'app']",['Other']
The best way to get rid of my life thank you so much ❤️,positive,0.70302,"['rid life', 'life thank', 'rid', 'way', 'life']",['Other']
why why u remove screen shoot😡😡,negative,-0.204,"['remove screen', 'screen shoot', 'shoot', 'remove', 'screen']",['Other']
"Good, but do not save after sending.",positive,0.0643,"['save send', 'save', 'send']","['Screenshot/Restrictions', 'Transaction History']"
"Very productive app, i love this app.",positive,0.5221399999999999,"['app love', 'love app', 'love', 'app']",['Other']
This app is best and safe secure,positive,0.7687933333333332,"['app secure', 'secure', 'app']",['Other']
"Am happy to use this app, because it's very nice to use .",positive,0.78268,"['use', 'use app', 'app use', 'app']",['Other']
It's the best app comper another local banks 🙏🙏Tnks cbe developers,positive,0.58214,"['developer', 'bank', 'app']",['Other']
What does it mean can't sync,negative,-0.125,"['mean', 'sync']",['App Performance']
The best application and easy my life,positive,0.7645066666666667,"['application life', 'life', 'application']",['Other']
ITS So easy and fast ✔✔✔✔✔✔✔,positive,0.4222866666666667,[],['Other']
Why is this app not working out of Addis Ababa?,neutral,0.0,"['app work', 'work', 'app']","['App Performance', 'Activation/Registration']"
Fast transaction really,positive,0.08,['transaction'],['Transactions']
good at using CBE to family and friends and consider it as the fastest and trusted Bank,positive,0.7865199999999999,"['consider bank', 'family friend', 'family', 'friend', 'consider']",['Other']
Nice view layout,positive,0.4928999999999999,"['layout', 'view']",['Interface Issues']
Best app. Improved speed,positive,0.88444,"['app improve', 'speed', 'improve', 'app']",['Other']
Its not working on my mobile,neutral,0.0,"['work mobile', 'mobile', 'work']","['App Performance', 'Activation/Registration']"
It is nice app & simple to use it,positive,0.3728999999999999,"['app use', 'use', 'app']",['Other']
Verification key not sending,neutral,0.0,"['verification key', 'key', 'verification', 'send']","['Account Access', 'Activation/Registration']"
The apps is good to use,positive,0.54424,"['app use', 'use', 'app']",['Other']
Very good and simple for use,positive,0.47762,['use'],['Other']
Fast and accurate,positive,0.12,[],['Other']
Application is very important for us thanks,positive,0.5109,"['application thank', 'thank', 'application']",['Other']
Good easy and fast,positive,0.5979577777777778,[],['Other']
Good & Perfect 👌,positive,0.88846,[],['Other']
this update crashes please do something,positive,0.1909199999999999,['update'],['Other']
Easy to use everywhere,positive,0.4375733333333333,['use'],['Other']
"It helps a lot,thanks",positive,0.2290799999999999,"['lot thank', 'help lot', 'lot', 'help', 'thank']",['Other']
No account balance shown,negative,-0.1775999999999999,"['account balance', 'balance', 'account']",['Transactions']
good app I like it,positive,0.6758199999999999,"['app like', 'like', 'app']",['Other']
So nice and easy to use,positive,0.6504866666666667,['use'],['Other']
it is good but sometime not working,positive,0.4229199999999999,['work'],"['App Performance', 'Activation/Registration']"
Góod and easy app,positive,0.4375733333333333,['app'],['Other']
Very good app. Thanks,positive,0.6704399999999999,"['app thank', 'thank', 'app']",['Other']
Better and good technology,positive,0.66018,['technology'],['Other']
This app have not working please more approve it.,positive,0.05534,"['approve', 'app work', 'work', 'app']","['App Performance', 'Activation/Registration']"
"It's good,but sometimes it's not work.",neutral,0.0,['work'],['Other']
The APP is very fast that is good,positive,0.45624,['app'],['Other']
Best of all mobile bank,positive,0.7821400000000001,['bank'],['Other']
Nice and smooth,positive,0.4528999999999999,[],['Other']
Need better Work on system,positive,0.46424,"['need work', 'need', 'work']",['Feature Requests']
I like this application and It's very useful,positive,0.57006,"['like application', 'like', 'application']",['Other']
The best banking and application,positive,0.7821400000000001,"['banking application', 'banking', 'application']",['Other']
Very late the only app is never seen in my life,negative,-0.078,"['app life', 'life', 'app']",['Notifications']
It's good and perfect app,positive,0.7989999999999999,['app'],['Other']
Best Application Thanks so much commercial Bank of Ethiopia,positive,0.63784,"['thank bank', 'application thank', 'bank ethiopia', 'ethiopia', 'thank']",['Other']
One of the fastest mobile banking app in Ethiopia thank you CBE 🙏,positive,0.21672,"['app thank', 'banking app', 'thank', 'banking', 'app']",['Transactions']
The best app 👌 I love it easy to use,positive,0.8305977777777778,"['love use', 'app love', 'love', 'use', 'app']",['Other']
