review,sentiment_label,sentiment_score,keywords,themes
"The CBE app has been highly unreliable in recent weeks. It frequently fails to work properly on both Ethio Telecom and Safaricom networks, whether using Wi-Fi or mobile data. This week, the system was down entirely for extended periods, making it very difficult to access banking services. The app only functions intermittently, and the lack of consistency is frustrating. I hope the issues are addressed soon, and that any non-technical influences are removed from such essential services.",negative,-0.5266620202020202,"['week', 'period make', 'remove service', 'work telecom', 'access banking']",['Transactions']
"this new update(Mar 19,2025) is great in fixing bugs, stability and smooth experience I'll give u that but it came with a big shortcoming which is not allowing to take screenshot. I can't screenshot neither my balance nor the transaction or anything within the app, i understand it's for security reasons but please bring that back, allow us to take screenshot we need that. Thanks.",positive,0.6604242424242425,"['screenshot', 'allow screenshot', 'allow', 'reason bring', 'screenshot balance']","['Transactions', 'Account Access', 'Feature Requests', 'Screenshot/Restrictions', 'Security Concerns']"
"Good job to the CBE team on this mobile app! It's designed in a way that's simple and intuitive to navigate, which is great for everyone. It effectively handles the essential banking tasks I need to perform regularly. It's a practical and reliable tool that makes everyday banking much more convenient. Thank you for this useful application.",positive,0.6956177777777778,"['perform tool', 'banking task', 'thank application', 'app design', 'banking thank']","['Feature Requests', 'Interface Issues']"
this app has developed in a very good ways but there are some comments I need to make 1- preventing the screenshot likely not good for someone like me coz I need to make screenshot for quicker evidence. 2-it would be good if you make us to access recent transaction histories for 30 days coz we don't have to go to the Bank's in person to see old transactions or add colander category so user can easily access old transactions through colanders.,positive,0.6026125925925927,"['colander', 'access transaction', 'screenshot', 'transaction', 'access']","['Transactions', 'Feature Requests', 'Screenshot/Restrictions']"
as if the update of march 19 i can't take a screenshot in the app. i can just save it as file and that is so annoying. i used to save all screenshot in my gallery in one folder now with the extra steps added i have to save the file go to file and then screenshot it. the solution is to allow the screenshot to be save in to gallery automatically. i wish you give this review attention and resolve the issue shortly.,positive,0.4634533333333333,"['screenshot', 'file', 'save', 'save file', 'gallery']","['Feature Requests', 'Screenshot/Restrictions', 'Transaction History']"
"Old version was very friendly to use. Now we can't see the #Reason The #transaction history (very limited) and now it crash every time it's opened. More over, the last update prevents us from taking #screenshots. Thanks for the developers as they are getting more stupid than ever.",negative,-0.0900878571428571,"['screenshot thank', 'reason transaction', 'update prevent', 'version use', 'open update']","['App Performance', 'Feature Requests', 'Transaction History']"
Taking away the screenshot of the receipt is just silly. Worse is tbe download button putting a copy of the screenshot - which you prevented to be taken - in tbe downloads folder where we cant attach directly from Whatsapp. Millions of people use the screenshot as proof of payment / transfer yet you make that harder for everyone? I have every user contacts the developer or manager who made this awful decision.,negative,-0.60236,"['screenshot', 'download', 'people use', 'screenshot prevent', 'screenshot proof']","['Transactions', 'Feature Requests', 'Interface Issues', 'Screenshot/Restrictions', 'Transaction History']"
"Recently there is big problem when sending to safaricom, telebir, and even to cbebirr wallet could anybody who is responsible fix it, it's very frustrating it's been 5 days and my money hasn't been returned it takes it out of my account but doesn't send it to my mpesa update- they have just corrected it and sent me back the money but still I'm afraid now to send again",negative,-0.2517733333333333,"['send', 'return account', 'safaricom telebir', 'money', 'account send']","['Transactions', 'Customer Service']"
"I was using this app for the last two years with no problems. It stopped working about 3 months ago. when I tried to transfer funds it gives me error ""can't do this transaction. inactive account.""",negative,-0.19644,"['problem stop', 'error transaction', 'transaction account', 'transfer fund', 'work month']","['Transactions', 'App Performance']"
"It's very good in reminding the account numbers you have been used, but Need to show recipient history whenever you want to present it.or it has to have a search on options for a spesfic time you want to look for receipts with out going for account details at bank. if you lost your receipt without downloading it and need to look sometime a while you can't get in simple search on the app.",positive,0.1285333333333333,"['search', 'receipt', 'look', 'want', 'recipient history']","['Transactions', 'Feature Requests', 'Screenshot/Restrictions', 'Transaction History']"
It crashes multiple times everytime you launch it. Fix it. Edit: crash fixed but screenshots has been disabled. I don't know who thought this was a good idea.,positive,0.3352799999999999,"['crash', 'screenshot disable', 'fix', 'fix screenshot', 'launch']",['App Performance']
"The latest update prevents taking screenshots, which is really annoying! please allow us to take screenshots! we need it for evidence (particularly, in case of transfer failure!).",negative,-0.3617566666666666,"['screenshot', 'screenshot allow', 'update prevent', 'evidence', 'prevent screenshot']","['Transactions', 'Feature Requests', 'Screenshot/Restrictions']"
"The history sometimes misses transactions, tranfer to cbe birr debited but not really transferred, We need to really cop up with the world for real. The hacks and security problems, invest on and solve them.",positive,0.08632,"['problem invest', 'world hack', 'debit transfer', 'security problem', 'transfer need']","['Transactions', 'Account Access', 'Feature Requests', 'Transaction History', 'Security Concerns']"
"every update was made the system better and better until the March 19th, 2025 update, not allowing us to screenshot. you guys didn't understand how much it's a really quick and significant thing. You add extra steps to us, which makes the process draw back",positive,0.5832688888888888,"['process draw', 'screenshot guy', 'draw', 'make process', 'thing add']",['Feature Requests']
"I’ve been using the CBE mobile banking app, and overall, I appreciate its features. However, I’ve noticed that when I turn on the developer options on my device, the app stops functioning properly. It would be great if you could look into this issue, as I often need to access developer settings for other applications. Thank you for your attention to this matter!",positive,0.5713149999999999,"['developer', 'banking appreciate', 'notice turn', 'option device', 'setting application']","['Transactions', 'Feature Requests']"
"Very good application. However, I have one functionality recommendation. What if you let the app transfer money to any telebirr account as for MPESA? By the way, I am not the only one to ask this. Thank you!",positive,0.63056,"['recommendation let', 'recommendation', 'mpesa', 'telebirr account', 'money telebirr']","['Transactions', 'Feature Requests']"
I have using the CBE mobile banking app. and overall i appreciate its Feuteres However i.ve Notticed that when i turn on the Developer options on my divice the App.Stop Functioning prorerly It.Would Be Great If You could look into This issue as l often need to access Developer setting for Otter Application ThankYou For Your attention to This Matter,positive,0.6836800000000001,"['developer', 'option divice', 'banking appreciate', 'access developer', 'attention matter']","['Transactions', 'Feature Requests']"
"In the previous, I gave 4 🌟 for this app based on my evaluation. This app was without biometric security and may be exposed to cheaters unexpectedly. It is solved now. You can add verification security on the setting app. But there is something problem still with verification. It must prevent logging in without correct input fingerprint.",negative,-0.3622333333333333,"['security', 'verification', 'security expose', 'security set', 'add verification']","['Account Access', 'Feature Requests', 'Security Concerns']"
"I don't understand the reason, why I need to disable developer options to access the app, it has no security risks nor does it hinder the app's functionalities. This goes out to the dev, I hope your life is filled with inconveniences.",positive,0.3985,"['risk hinder', 'security risk', 'app functionality', 'hinder', 'option access']","['Account Access', 'Feature Requests', 'Security Concerns']"
before it was smooth and good. this time after the new update in 2025 i can not make screenshot of my recite. even the downlod button is very delayed in putting my recite in my gallery for simple proof. please fix this i am unable to show proof of payment to my clients. thankyou.,positive,0.3384842424242424,"['recite', 'proof', 'payment client', 'proof fix', 'recite downlod']","['Transactions', 'Interface Issues', 'Screenshot/Restrictions']"
"my first frequent experience of cbe app is critical-time failure such as suspending payment on air for 2-5 days with zero explanation, deducting from sender account without depositing to the receiver act. Another fatal error by the banking company as a whole (not the app itself though) is forced-banking with corporations without consent of employers-users of the corresponding corporations",negative,-0.5091533333333332,"['corporation', 'payment air', 'consent', 'error bank', 'suspend']","['Transactions', 'App Performance']"
Please bring back the screenshot option. The screenshot download option takes like 15 second appear in gallery and most people don't know about it.,positive,0.4182066666666666,"['screenshot', 'option', 'option appear', 'option screenshot', 'bring screenshot']","['Feature Requests', 'Screenshot/Restrictions']"
"The recent update automatically turns the developers option on, and when one starts the app, a message pops up saying the app does not work with the developers option on. So, one has to go to the settings and manually turn the developers option off. Otherwise the app doesn't work.",neutral,0.0,"['developer option', 'developer', 'option', 'turn developer', 'turn']","['Feature Requests', 'Notifications']"
"The review page keeps loading, and even sync is completed. The history page always shows old/unknown transactions. ...... Edited: I guess the loading page means it expires and needs to go to the nearest bank and ask for an extension for another 3 years. Upgrade to 3 stars .",neutral,0.0,"['page', 'loading', 'page loading', 'page mean', 'review page']","['App Performance', 'Feature Requests', 'Transaction History']"
"First this app was pretty good and well connection while transferring money, but now there's no such a worst mob app ever while transferring money it corrupts due to the network and took the amount of money you were transferring from your account then after seconds interruptions it's shows that the money is transferred (this case happens especially to telebirrr wallet) then after you report the issue to the CBE customer service they refund your money to your CBE account after 3-5 days.",negative,-0.5090142857142856,"['money', 'transfer', 'money transfer', 'transfer money', 'cbe']","['Transactions', 'App Performance']"
Two step verification update is fake (meaningless). Why because the app gives you an option of to use pin while requesting two step verification step. 🔐 This updated app is not differ than the previous one in case of security & safegaurding users.👹👹💀💀 The other features of the app are best and easy to use it.⭐️⭐️⭐️⭐️⭐️,positive,0.3348244444444444,"['step', 'step verification', 'verification', 'update app', 'request step']","['Account Access', 'Feature Requests', 'Security Concerns']"
What an absolutely terrible update. No screenshots and you still have this stupid restriction on developer options. WHAT ABOUT THOSE OF US WHO ARE ACTUALLY DEVELOPERS!!!!!! At this point telebirr just wins the game 100%. CBE. Do. Better!,negative,-0.54082,"['developer', 'restriction developer', 'option developer', 'screenshot restriction', 'update screenshot']","['Transactions', 'Screenshot/Restrictions']"
Really! this app is more simple to use at any time in every where also it's transaction quality between the users within the transaction receipt as abank that means this app is our bank on hand in mobile frankly I proud on this bank digital. I have no word to wrote ...... but it's have weakness on poor connection.,negative,-0.3819733333333333,"['receipt mean', 'wrote', 'wrote weakness', 'bank hand', 'mobile bank']","['Transactions', 'Screenshot/Restrictions', 'Transaction History']"
"The app is full of bugs here and there, perhaps it's from the backend side idk. For instance the transaction history you see on top is one made a couple of months ago and you have to refresh until you reach the top. it's just so bizarre. And you can't even search for a transaction you made. Someone with a lot of transactions will find it annoying. Even simple things like localising dates to Amharic dates are now correctly implemented.",negative,-0.0712466666666666,"['date', 'transaction', 'reach search', 'refresh reach', 'bug instance']","['Transactions', 'App Performance', 'Feature Requests', 'Transaction History', 'Language Support']"
It made life alot easier. I cant even imagine having to make all those transactions in person. So this app was crucial for me. Very good app. well done.,positive,0.66824,"['person app', 'transaction person', 'imagine', 'alot', 'person']",['Other']
It used to be the best bank app in Ethiopia. But now using it is a terrible experience. For every transaction it shows an error message. Making a simple payment requires 5 to 6 trials to complete.,negative,-0.4261399999999999,"['payment require', 'require trial', 'trial', 'make payment', 'transaction error']","['Transactions', 'App Performance']"
I'm sad guys what are you doing? Why did you add the screenshot restriction to the app? You just made it worse it was a great value to us. You need to rethink it. i will change the 1 star rating when you resolve the issue.,positive,0.1588066666666666,"['rating resolve', 'rethink', 'rethink change', 'resolve issue', 'restriction app']","['Feature Requests', 'Screenshot/Restrictions']"
If any developer is reading this please fix the screenshot functionality or at least the download button should work flawlessly without me touching it twenty times.,positive,0.4784199999999999,"['read fix', 'screenshot functionality', 'work touch', 'download button', 'fix screenshot']","['Feature Requests', 'Interface Issues', 'Screenshot/Restrictions']"
Its good but we need an option of choosing a specific period to get a historique of transactions. For example when i want to check my previous transactions i only get few transactions. Thank you.,positive,0.4381466666666666,"['transaction', 'period historique', 'need option', 'option choose', 'check transaction']",['Feature Requests']
well designed! Fixing bugs & two step verification with biometric... simply it's great!,positive,0.86632,"['biometric', 'step verification', 'fix bug', 'design', 'step']",['Account Access']
always disappointing ! especially the iOS one !! some similar local applications are extremely superior to this application!! Really disappointing!,negative,-0.4058733333333333,"['application application', 'application']",['Other']
"As an app developer, I rely on Developer Mode to build and test apps, but this app blocks access entirely if it's enabled. This restriction is unnecessary and makes it impossible for developers to use the service. Instead of outright blocking, consider implementing enhanced security measures that don't alienate professionals who need this setting. Please reconsider this policy.",negative,-0.3907422222222222,"['developer', 'professional need', 'reconsider policy', 'rely developer', 'restriction make']","['Account Access', 'Feature Requests', 'Screenshot/Restrictions', 'Security Concerns']"
it is good app. But you have integrate cbe with cbe birr. to allow cardless withdrawal directly from our accout!,positive,0.51168,"['accout', 'allow cardless', 'app integrate', 'cardless', 'integrate']","['Transactions', 'Feature Requests']"
Doesn't work properly. It crashes some many times. commercial bank of Ethiopia not only the application but also sending money to own CBE birr doesn't get your money in your bank account. forcefully you must wait 3-5 days to get your money back to your account. walk up CBE the world is going to decentralized finance.,positive,0.0733333333333333,"['money', 'world finance', 'account', 'application send', 'day money']","['Transactions', 'App Performance', 'Customer Service']"
"I am not exaggerating when I say that this application is one of the biggest players in the banking industry. It has simplified a lot of things for the user, even if the bank is in his pocket. But my opinion is (1), when we transfer money, there is a word limit on the (Note) at the end. Why can't we write our reason briefly? I don't understand why it is limited. On the other hand, there is no limit on the bank. Could you explain this? (2), when we pay for water, why is the code not mentioned",negative,-0.1106704761904762,"['limit', 'pay water', 'reason understand', 'lot thing', 'pocket']",['Transactions']
"I have seen lots of great updates right here, especially the 2FA using the biometric security technique, I suggest you work on minimising app crashing due to the accumulation of cache, very little cache crash it.",positive,0.4100971428571429,"['crash', 'security technique', 'lot update', 'update security', 'cache']","['App Performance', 'Account Access', 'Feature Requests', 'Security Concerns']"
"Add customer service please other than calling 951. Why would you have a mobile app but not an online text-based customer service? Why? Disappointing And I will never use the top-up feature again, I have been trying to recharge my safaricom balance but your app would say time out and then credit my account but never recharge my balance, why? Where is my money? Do you expect me to call 951 at midnight?",negative,-0.32392,"['recharge', 'customer service', 'customer', 'balance', 'recharge balance']","['Transactions', 'Feature Requests', 'Customer Service']"
"Why on earth is CBE telling me to turn off developer mode? As the name clearly states, it's for developers, not for CBE to dictate. There are countless financial apps out there that work just fine without demanding such an unnecessary restriction. If your app can’t handle developer mode, that’s a you problem. Fix your code instead of disabling features that have absolutely nothing to do with you.",negative,-0.2270647619047618,"['developer', 'developer mode', 'mode', 'cbe', 'earth']",['Other']
"I really like this app as it is being updated from time to time and includes multiple payment options. In particular, giving a receipt makes it even more preferable. However, when it is refreshed, it does not show the history of credit and deposit in order and, I am of the opinion that it is better if the recent history is fixed respectively according to the transaction date in the future because there is a problem of confusion.",positive,0.5461451851851852,"['history', 'order opinion', 'problem confusion', 'receipt make', 'refresh history']","['Transactions', 'Feature Requests', 'Screenshot/Restrictions', 'Transaction History']"
"The previous version is much better than this one. I used it for more than six years without any problem. But now I'm having a serious trouble with the updated app. I don't know why it takes him forever to refresh and load the home page once you sign in. And if it fails to load, it never recovers. I only see some UI changes. Really disappointed",negative,-0.58366,"['load', 'page sign', 'problem trouble', 'recover ui', 'refresh load']",['App Performance']
"I like the application very much because it is user friendly and makes transactions easiest, especially for business matters. But, these few days I faced difficulties of opening it. I tried to uninstall and re install the app, and re verified at the nearest cbe center. But still failed to use all the functions. It says 'none available'. Any suggestions please!",negative,-0.0816571428571428,"['say suggestion', 'application user', 'fail use', 'open try', 'use function']","['Transactions', 'Interface Issues', 'Activation/Registration']"
"Most of the time, in the 'Recents' button the app becomes stuck and doesn't show up details of transactions and doesn't even scroll down; should be solved. Second, the app doesn't save the last pop-up screen when a transaction is complete. Third, there is no telebirr transfer to other person option and the app by default lets you to only own telebirr transfer.",negative,-0.3046758024691358,"['person option', 'recent button', 'save pop', 'screen transaction', 'scroll solve']","['Transactions', 'App Performance', 'Feature Requests', 'Interface Issues', 'Screenshot/Restrictions', 'Transaction History']"
"It's a great app. I've been using this app since the bank launched it. As a long-term user, I would like to point out things that need to be improved. 1. Deleting money transfer history should be the user's choice. 2. There should be an option to download an in-depth transfer history for each transfer activity , just as there is posiblity to download a single time transfer recit. Do that and get 5 star.",positive,0.6741342857142858,"['transfer', 'transfer history', 'history', 'download', 'user']","['Transactions', 'Feature Requests', 'Screenshot/Restrictions', 'Transaction History']"
"This app has several issues based on my experience. Below are the problems that I encountered: 1. The app frequently crashes. 2. It only shows a limited transaction record history (25 transactions). 3. You can't access the transaction records after 8:00 pm and on Sundays. 4. It displays a ""payment failed"" message. It would be greatly appreciated if you could address these issues",negative,-0.3251752380952381,"['transaction record', 'record', 'transaction', 'issue', 'record history']","['Transactions', 'Feature Requests', 'Screenshot/Restrictions', 'Transaction History']"
1 star because I have to visit my bank for new installation of the app and reactivation takes about 45 to 60 minutes with there long queue and system failures. Learn from telebire app and give options to customers to apt out of this ridiculous security feature. Second why is there no customization in the settings for displaying which account I want displayed in the first section rather that slide to my main account every time. You are making us pay a monthly subscription. Bare minimum is not it,negative,-0.3778151515151514,"['display', 'option customer', 'pay subscription', 'queue', 'queue failure']","['Account Access', 'Feature Requests', 'Security Concerns']"
"My experience with this app has been outstanding so far,but sometimes it has a hard time connecting with network and makes it hard to make transactions. Apart from that it's amazing.",positive,0.5260266666666666,"['network make', 'experience app', 'make transaction', 'connect', 'app time']",['App Performance']
"I have been using this app for almost four years now. In the beginning, it was working fine. Sometime later, it gets difficult to create a connection to my account, and could not manage to make and see transactions on my account. After updating it lately, Jul 2020, I was glad this app came with some user interface improvements, and the connection was quite fast. Not longer than two weeks, the app starts to get stuck, and it cannot even show me the UI properly. As a result, I have a useless app on my cell phone, hoping that [you] will soon come with updates.",positive,0.3339733333333333,"['come', 'connection', 'phone hope', 'result app', 'year beginning']","['App Performance', 'Interface Issues']"
"Application UI and new features are better than the previous version. I found a minor bugs though. I couldn't transfer to an account from the beneficiary list, it says None Available; There is still so much to do with the localization; Instead of ሰኔ it says ጁን and more like this; date conversion is missing also. If this minor things are fixed it will be much better.",positive,0.5832689807162534,"['say', 'say localization', 'say ጁን', 'ጁን', 'ጁን date']","['Transactions', 'Feature Requests', 'Notifications']"
"It is a good and progressive app through the updates. I think the app should further solve its bugs like 1. It doesn't download or share attachment on android 12 and 11, it used to work on android 10. 2. Sometimes transactions seem like they have failed and there are no records, but the transactions actually have passed this is a very serious issue, because people will try the transaction again which will end up doubling the payment.",neutral,0.0378533333333333,"['transaction', 'pass issue', 'people try', 'app solve', 'attachment']","['Transactions', 'Feature Requests', 'Screenshot/Restrictions']"
